La incertidumbre, la volatilidad y el cambio permanente se han convertido en el nuevo estándar que rigen el mundo de los negocios. Tommaso Canonici, Antonio Núñez.
La ambigüedad es una de las principales causas de muerte empresarial. Una de las principales labores de todo líder consiste en aportar claridad a las tareas y objetivos de sus colaboradores. Tommaso Canonici, Antonio Núñez.
Los nuevos escenarios de los negocios están propiciando el surgimiento de un liderazgo menos unipersonal y más coral y participativo que sitúa a las personas en el centro. Tommaso Canonici, Antonio Núñez.
El miedo al error impide a los líderes tomar decisiones audaces cuando más falta hace que se comporten con audacia. Tommaso Canonici, Antonio Núñez.
La revolución tecnológica juega un papel determinante en todos los cambios que sacuden el mundo, no sólo en aquellos que tienen que ver con la transformación digital, sino también con los de carácter social o económico. Tommaso Canonici, Antonio Núñez.
La velocidad del cambio obliga a reformular el concepto de estrategia en términos menos reflexivos y más de acción. Hoy hay que pensar menos en la estrategia y más en la ejecución. Las grandes carencias de las compañías han dejado de ser de carácter financiero, sino que están en su falta de habilidades para transformar ideas prometedoras en proyectos reales. Tommaso Canonici, Antonio Núñez.
La pregunta que debería hacerse todo directivo cada mañana es: "¿de qué forma puedo seguir siendo relevante para mis clientes?". Tommaso Canonici, Antonio Núñez.
